{
  "suite_id": "HBOT-TREATMENT-TARGET-KA-CANONICAL-FIXTURES",
  "suite_version": "1.0",
  "cks_status": "CKS Version 1.0",
  "cks_version_iri": "https://kgrid.org/cks/hbot-treatment-target-ka/versions/cks-1.0",
  "fixtures": [
    {
      "fixture_id": "MATRIX-POS-01",
      "category": "matrix_cell_positive",
      "polarity": "positive",
      "cks_requirements": [
        "SYN-VU-L-01",
        "INV-01",
        "INV-23"
      ],
      "given": {
        "hbot_native_result": "OUTPUT-02",
        "prognosis_projection": "VERY_UNFAVORABLE_PROGNOSIS_BAND",
        "burden_projection": "LOWER_BURDEN_BAND",
        "dependency_engagements": [
          {
            "role": "DEP-WAGNER",
            "state": "completed_valid",
            "engagement_mode": "fresh_invocation",
            "validation_status": "valid"
          },
          {
            "role": "DEP-HBOT-DECISION",
            "state": "completed_valid",
            "engagement_mode": "fresh_invocation",
            "validation_status": "valid"
          },
          {
            "role": "DEP-BURDEN",
            "state": "completed_valid",
            "engagement_mode": "fresh_invocation",
            "validation_status": "valid"
          },
          {
            "role": "DEP-MARGOLIS",
            "state": "completed_valid",
            "engagement_mode": "fresh_invocation",
            "validation_status": "valid"
          }
        ],
        "injected_conditions": []
      },
      "expect": {
        "status": "completed",
        "target_classification": "ON_TARGET",
        "reason_code": "KA-RESULT-SUPPORTED-SYNTHESIS",
        "gate_result": "SUPPORTED",
        "synthesis_rule_id": "SYN-VU-L-01",
        "completed_classification_permitted": true,
        "diagnostics_include": []
      }
    },
    {
      "fixture_id": "MATRIX-NEG-01",
      "category": "matrix_cell_negative",
      "polarity": "negative",
      "cks_requirements": [
        "SYN-VU-L-01",
        "INV-01",
        "INV-21",
        "INV-37"
      ],
      "given": {
        "hbot_native_result": "OUTPUT-02",
        "prognosis_projection": "VERY_UNFAVORABLE_PROGNOSIS_BAND",
        "burden_projection": "LOWER_BURDEN_BAND",
        "dependency_engagements": [
          {
            "role": "DEP-WAGNER",
            "state": "completed_invalid",
            "engagement_mode": "fresh_invocation",
            "validation_status": "invalid"
          },
          {
            "role": "DEP-HBOT-DECISION",
            "state": "completed_valid",
            "engagement_mode": "fresh_invocation",
            "validation_status": "valid"
          },
          {
            "role": "DEP-BURDEN",
            "state": "completed_valid",
            "engagement_mode": "fresh_invocation",
            "validation_status": "valid"
          },
          {
            "role": "DEP-MARGOLIS",
            "state": "completed_valid",
            "engagement_mode": "fresh_invocation",
            "validation_status": "valid"
          }
        ],
        "injected_conditions": [
          {
            "code": "output_contract",
            "role": "DEP-WAGNER"
          }
        ]
      },
      "expect": {
        "status": "indeterminate",
        "target_classification": "INDETERMINATE",
        "reason_code": "KA-ERR-OUTPUT-CONTRACT",
        "gate_result": "NOT_EVALUABLE",
        "synthesis_rule_id": null,
        "completed_classification_permitted": false,
        "diagnostics_include": [
          "KA-ERR-OUTPUT-CONTRACT"
        ]
      }
    },
    {
      "fixture_id": "MATRIX-POS-02",
      "category": "matrix_cell_positive",
      "polarity": "positive",
      "cks_requirements": [
        "SYN-VU-M-02",
        "INV-01",
        "INV-23"
      ],
      "given": {
        "hbot_native_result": "OUTPUT-02",
        "prognosis_projection": "VERY_UNFAVORABLE_PROGNOSIS_BAND",
        "burden_projection": "MIDDLE_BURDEN_BAND",
        "dependency_engagements": [
          {
            "role": "DEP-WAGNER",
            "state": "completed_valid",
            "engagement_mode": "fresh_invocation",
            "validation_status": "valid"
          },
          {
            "role": "DEP-HBOT-DECISION",
            "state": "completed_valid",
            "engagement_mode": "fresh_invocation",
            "validation_status": "valid"
          },
          {
            "role": "DEP-BURDEN",
            "state": "completed_valid",
            "engagement_mode": "fresh_invocation",
            "validation_status": "valid"
          },
          {
            "role": "DEP-MARGOLIS",
            "state": "completed_valid",
            "engagement_mode": "fresh_invocation",
            "validation_status": "valid"
          }
        ],
        "injected_conditions": []
      },
      "expect": {
        "status": "completed",
        "target_classification": "ON_TARGET",
        "reason_code": "KA-RESULT-SUPPORTED-SYNTHESIS",
        "gate_result": "SUPPORTED",
        "synthesis_rule_id": "SYN-VU-M-02",
        "completed_classification_permitted": true,
        "diagnostics_include": []
      }
    },
    {
      "fixture_id": "MATRIX-NEG-02",
      "category": "matrix_cell_negative",
      "polarity": "negative",
      "cks_requirements": [
        "SYN-VU-M-02",
        "INV-01",
        "INV-21",
        "INV-37"
      ],
      "given": {
        "hbot_native_result": "OUTPUT-02",
        "prognosis_projection": "VERY_UNFAVORABLE_PROGNOSIS_BAND",
        "burden_projection": "MIDDLE_BURDEN_BAND",
        "dependency_engagements": [
          {
            "role": "DEP-WAGNER",
            "state": "completed_valid",
            "engagement_mode": "fresh_invocation",
            "validation_status": "valid"
          },
          {
            "role": "DEP-HBOT-DECISION",
            "state": "completed_invalid",
            "engagement_mode": "fresh_invocation",
            "validation_status": "invalid"
          },
          {
            "role": "DEP-BURDEN",
            "state": "completed_valid",
            "engagement_mode": "fresh_invocation",
            "validation_status": "valid"
          },
          {
            "role": "DEP-MARGOLIS",
            "state": "completed_valid",
            "engagement_mode": "fresh_invocation",
            "validation_status": "valid"
          }
        ],
        "injected_conditions": [
          {
            "code": "output_contract",
            "role": "DEP-HBOT-DECISION"
          }
        ]
      },
      "expect": {
        "status": "indeterminate",
        "target_classification": "INDETERMINATE",
        "reason_code": "KA-ERR-OUTPUT-CONTRACT",
        "gate_result": "NOT_EVALUABLE",
        "synthesis_rule_id": null,
        "completed_classification_permitted": false,
        "diagnostics_include": [
          "KA-ERR-OUTPUT-CONTRACT"
        ]
      }
    },
    {
      "fixture_id": "MATRIX-POS-03",
      "category": "matrix_cell_positive",
      "polarity": "positive",
      "cks_requirements": [
        "SYN-VU-H-03",
        "INV-01",
        "INV-23"
      ],
      "given": {
        "hbot_native_result": "OUTPUT-02",
        "prognosis_projection": "VERY_UNFAVORABLE_PROGNOSIS_BAND",
        "burden_projection": "HIGHER_BURDEN_BAND",
        "dependency_engagements": [
          {
            "role": "DEP-WAGNER",
            "state": "completed_valid",
            "engagement_mode": "fresh_invocation",
            "validation_status": "valid"
          },
          {
            "role": "DEP-HBOT-DECISION",
            "state": "completed_valid",
            "engagement_mode": "fresh_invocation",
            "validation_status": "valid"
          },
          {
            "role": "DEP-BURDEN",
            "state": "completed_valid",
            "engagement_mode": "fresh_invocation",
            "validation_status": "valid"
          },
          {
            "role": "DEP-MARGOLIS",
            "state": "completed_valid",
            "engagement_mode": "fresh_invocation",
            "validation_status": "valid"
          }
        ],
        "injected_conditions": []
      },
      "expect": {
        "status": "completed",
        "target_classification": "NEAR_TARGET",
        "reason_code": "KA-RESULT-SUPPORTED-SYNTHESIS",
        "gate_result": "SUPPORTED",
        "synthesis_rule_id": "SYN-VU-H-03",
        "completed_classification_permitted": true,
        "diagnostics_include": []
      }
    },
    {
      "fixture_id": "MATRIX-NEG-03",
      "category": "matrix_cell_negative",
      "polarity": "negative",
      "cks_requirements": [
        "SYN-VU-H-03",
        "INV-01",
        "INV-21",
        "INV-37"
      ],
      "given": {
        "hbot_native_result": "OUTPUT-02",
        "prognosis_projection": "VERY_UNFAVORABLE_PROGNOSIS_BAND",
        "burden_projection": "HIGHER_BURDEN_BAND",
        "dependency_engagements": [
          {
            "role": "DEP-WAGNER",
            "state": "completed_valid",
            "engagement_mode": "fresh_invocation",
            "validation_status": "valid"
          },
          {
            "role": "DEP-HBOT-DECISION",
            "state": "completed_valid",
            "engagement_mode": "fresh_invocation",
            "validation_status": "valid"
          },
          {
            "role": "DEP-BURDEN",
            "state": "completed_invalid",
            "engagement_mode": "fresh_invocation",
            "validation_status": "invalid"
          },
          {
            "role": "DEP-MARGOLIS",
            "state": "completed_valid",
            "engagement_mode": "fresh_invocation",
            "validation_status": "valid"
          }
        ],
        "injected_conditions": [
          {
            "code": "output_contract",
            "role": "DEP-BURDEN"
          }
        ]
      },
      "expect": {
        "status": "indeterminate",
        "target_classification": "INDETERMINATE",